reading from file password.pcap, link-type EN10MB (Ethernet), snapshot length 262144
19:34:44.867173 IP 10.100.109.192.telnet > 10.100.108.62.51982: Flags [P.], seq 3242326624:3242326634, ack 1675728972, win 509, options [nop,nop,TS val 1905350473 ecr 1775669027], length 10
E..>..@.@..`
dm.
dl>.....A.`c..L....YT.....
q.WIi..#Password: 
19:34:46.013404 IP 10.100.108.62.51982 > 10.100.109.192.telnet: Flags [P.], seq 1:2, ack 10, win 502, options [nop,nop,TS val 1775670177 ecr 1905350473], length 1
E..5..@.@...
dl>
dm.....c..L.A.j...........
i...q.WIs
19:34:46.494113 IP 10.100.108.62.51982 > 10.100.109.192.telnet: Flags [P.], seq 2:3, ack 10, win 502, options [nop,nop,TS val 1775670658 ecr 1905351665], length 1
E..5..@.@...
dl>
dm.....c..M.A.j...........
i...q.[.a
19:34:48.254773 IP 10.100.108.62.51982 > 10.100.109.192.telnet: Flags [P.], seq 3:4, ack 10, win 502, options [nop,nop,TS val 1775672419 ecr 1905352105], length 1
E..5..@.@...
dl>
dm.....c..N.A.j...........
i..cq.].i
19:34:48.645196 IP 10.100.108.62.51982 > 10.100.109.192.telnet: Flags [P.], seq 4:5, ack 10, win 502, options [nop,nop,TS val 1775672809 ecr 1905353864], length 1
E..5..@.@...
dl>
dm.....c..O.A.j...........
i...q.d.r
19:34:48.888617 IP 10.100.108.62.51982 > 10.100.109.192.telnet: Flags [P.], seq 5:6, ack 10, win 502, options [nop,nop,TS val 1775673052 ecr 1905354255], length 1
E..5..@.@...
dl>
dm.....c..P.A.j...........
i...q.f.a
19:34:49.135523 IP 10.100.108.62.51982 > 10.100.109.192.telnet: Flags [P.], seq 6:7, ack 10, win 502, options [nop,nop,TS val 1775673299 ecr 1905354498], length 1
E..5..@.@...
dl>
dm.....c..Q.A.j...........
i...q.g.j
19:34:49.914273 IP 10.100.108.62.51982 > 10.100.109.192.telnet: Flags [P.], seq 7:8, ack 10, win 502, options [nop,nop,TS val 1775674078 ecr 1905354745], length 1
E..5..@.@...
dl>
dm.....c..R.A.j...........
i...q.g.@
19:34:50.396548 IP 10.100.108.62.51982 > 10.100.109.192.telnet: Flags [P.], seq 8:9, ack 10, win 502, options [nop,nop,TS val 1775674560 ecr 1905355524], length 1
E..5..@.@...
dl>
dm.....c..S.A.j...........
i...q.k.1
19:34:50.743982 IP 10.100.108.62.51982 > 10.100.109.192.telnet: Flags [P.], seq 9:10, ack 10, win 502, options [nop,nop,TS val 1775674908 ecr 1905356006], length 1
E..5..@.@...
dl>
dm.....c..T.A.j...........
i...q.l.2
19:34:51.034636 IP 10.100.108.62.51982 > 10.100.109.192.telnet: Flags [P.], seq 10:11, ack 10, win 502, options [nop,nop,TS val 1775675198 ecr 1905356354], length 1
E..5.	@.@...
dl>
dm.....c..U.A.j...........
i..>q.nB3
19:34:51.248226 IP 10.100.108.62.51982 > 10.100.109.192.telnet: Flags [P.], seq 11:13, ack 10, win 502, options [nop,nop,TS val 1775675412 ecr 1905356683], length 2
E..6.
@.@...
dl>
dm.....c..V.A.j...........
i...q.o..
19:34:51.251752 IP 10.100.109.192.telnet > 10.100.108.62.51982: Flags [P.], seq 10:12, ack 13, win 509, options [nop,nop,TS val 1905356858 ecr 1775675412], length 2
E..6..@.@..\
dm.
dl>.....A.jc..X.....#.....
q.p:i...

19:34:51.672434 IP 10.100.109.192.telnet > 10.100.108.62.51982: Flags [P.], seq 12:450, ack 13, win 509, options [nop,nop,TS val 1905357252 ecr 1775675416], length 438
E.....@.@...
dm.
dl>.....A.lc..X.....l.....
q.q.i...Welcome to Ubuntu 20.04.3 LTS (GNU/Linux 5.11.0-34-generic x86_64)

 * Documentation:  https://help.ubuntu.com
 * Management:     https://landscape.canonical.com
 * Support:        https://ubuntu.com/advantage

8 updates can be applied immediately.
5 of these updates are standard security updates.
To see these additional updates run: apt list --upgradable

Your Hardware Enablement Stack (HWE) is supported until April 2025.

